{
 "method": "Custom photon Monte Carlo (3e6 source photons, 10x10 pyramid at SSD 100 cm, XCOM interactions, Klein-Nishina/Rayleigh/pair kernels) with next-event scoring to a 7-point average over the 1 cm-radius cylinder at depths 0.25\u20135 cm; primary fluence analytic (exp(-mu*d) with inverse-square to 105 cm); interaction and energy-transfer fractions from fluence x mu_i(E); electron source spectra from Klein-Nishina kinematics; electron fluence from CSDA slowing-down with Moller knock-on production (ESTAR stopping powers); K = Phi*E*mu_tr, K_col = K(1-g) with g from ESTAR yields, D = K_col (beta = 1, CPE); Spencer-Attix water/air with Delta = 10 keV via restricted Moller losses and Bethe scaling for air, plus track-end term; PDD from K_col depth profile convolved with an electron kernel (lambda = 0.09 cm) giving d_max \u2248 0.5 cm. Approximations: L4 angular uses initial-direction distribution; photoelectric/pair electron directions taken as photon direction; air data not in provided files.",
 "data_sources": "XCOM-style water photon coefficients (/tmp/data/xcom_water.txt: coherent, incoherent, photoelectric, pair, total with coherent) for all attenuation and interaction rates; ESTAR-style water electron stopping powers, CSDA ranges, radiation yields and density-effect data (/tmp/data/estar_water.txt); analytic Klein-Nishina and Moller cross sections; air stopping-power ratio scaled from water using Bethe formula with I_air = 85.7 eV and Z/A = 0.49919 (air table not provided).",
 "L1_primary_fluence_per_phi0": 0.72948,
 "L1_total_fluence_per_phi0": 1.14763,
 "L1_scattered_fraction_fluence": 0.36436,
 "L1_scattered_fraction_energy_fluence": 0.18038,
 "L1_mean_photon_energy_MeV": 0.97226,
 "L1_photon_fluence_spectrum_primary": [
  0.0,
  0.0,
  0.0,
  0.0,
  0.0,
  0.0,
  0.0,
  0.0,
  0.0,
  0.0,
  0.0,
  0.0,
  0.0,
  0.0,
  0.0,
  0.0,
  0.0,
  0.0,
  0.0,
  0.0,
  0.0,
  0.0,
  0.0,
  0.36101,
  0.0,
  0.0,
  0.36847,
  0.0
 ],
 "L1_photon_fluence_spectrum_scattered": [
  0.00551,
  0.0334,
  0.03878,
  0.03335,
  0.04293,
  0.02853,
  0.02038,
  0.017,
  0.01491,
  0.01398,
  0.01343,
  0.01339,
  0.01302,
  0.01356,
  0.01231,
  0.01146,
  0.01099,
  0.01088,
  0.01054,
  0.01017,
  0.01009,
  0.0101,
  0.01026,
  0.0075,
  0.00442,
  0.00432,
  0.00297,
  0.0
 ],
 "L1_angular_primary": [
  0.0,
  0.0,
  0.0,
  0.0,
  0.0,
  0.0,
  0.0,
  0.0,
  0.0,
  1.0
 ],
 "L1_angular_scattered": [
  0.07669,
  0.0712,
  0.06823,
  0.06535,
  0.06702,
  0.07123,
  0.08185,
  0.10464,
  0.15217,
  0.24161
 ],
 "L2_interaction_fractions": {
  "compton": 0.98393,
  "photoelectric": 0.00728,
  "pair": 0.00013,
  "rayleigh": 0.00866
 },
 "L2_energy_transfer_fractions": {
  "compton": 0.99844,
  "photoelectric": 0.00144,
  "pair": 0.00011,
  "rayleigh": 0.0
 },
 "L2_interaction_fractions_primary": {
  "compton": 0.99912,
  "photoelectric": 4e-05,
  "pair": 0.00027,
  "rayleigh": 0.00057
 },
 "L2_interaction_fractions_scattered": {
  "compton": 0.9694,
  "photoelectric": 0.0142,
  "pair": 0.0,
  "rayleigh": 0.0164
 },
 "L2_scattered_share_of_interactions": 0.51119,
 "L3_initial_spectrum": [
  0.18893,
  0.1193,
  0.06662,
  0.05112,
  0.04334,
  0.03867,
  0.03659,
  0.03183,
  0.03209,
  0.02907,
  0.02728,
  0.0284,
  0.02798,
  0.02625,
  0.02832,
  0.02944,
  0.03203,
  0.03553,
  0.04415,
  0.0265,
  0.01996,
  0.02501,
  0.01159,
  1e-05,
  1e-05
 ],
 "L3_initial_spectrum_parent_primary": [
  0.03157,
  0.05158,
  0.03606,
  0.04198,
  0.04155,
  0.04094,
  0.04238,
  0.03742,
  0.04104,
  0.03813,
  0.03718,
  0.04112,
  0.04186,
  0.04,
  0.04503,
  0.04816,
  0.054,
  0.06152,
  0.07863,
  0.04725,
  0.03572,
  0.04554,
  0.02132,
  2e-05,
  2e-05
 ],
 "L3_mean_initial_energy_MeV": 0.3556,
 "L3_mean_initial_energy_parent_primary_MeV": 0.58527,
 "L3_initial_direction": [
  0.04085,
  0.05141,
  0.04045,
  0.04236,
  0.04695,
  0.05481,
  0.07442,
  0.10727,
  0.16982,
  0.37168
 ],
 "L4_electron_fluence_per_phi0": 0.012797,
 "L4_electron_fluence_spectrum": [
  0.00048,
  0.00072,
  0.00081,
  0.00087,
  0.00089,
  0.00088,
  0.00087,
  0.00084,
  0.00081,
  0.00077,
  0.00072,
  0.00068,
  0.00063,
  0.00058,
  0.00052,
  0.00046,
  0.0004,
  0.00033,
  0.00024,
  0.00015,
  0.00011,
  6e-05,
  1e-05,
  0.0,
  0.0
 ],
 "L4_delta_fraction": 0.03081,
 "L4_mean_electron_energy_MeV": 0.43034,
 "L4_angular": [
  0.04085,
  0.05141,
  0.04045,
  0.04236,
  0.04695,
  0.05481,
  0.07442,
  0.10727,
  0.16982,
  0.37168
 ],
 "L4_radiative_to_collision": 0.00249,
 "L5_D_over_phi0_Gy_cm2": 5.302e-12,
 "L5_K_over_phi0_Gy_cm2": 5.315e-12,
 "L5_Kcol_over_phi0_Gy_cm2": 5.302e-12,
 "L5_beta": 1.0,
 "L5_g": 0.00261,
 "L5_dose_fraction_parent_scattered": 0.18881,
 "L5_s_w_air": 1.131,
 "L5_PDD5_percent": 81.2
}