{
 "method": "Point-source photon Monte Carlo (10x10 pyramid at 100 cm SSD, 2 MeV) in a 30 cm water cube with XCOM coefficients and Klein-Nishina Compton sampling; annihilation photons from pair production; Rayleigh with Thomson-like angles. Fluence, angular and interaction tallies use track-length estimators over the 1 cm x 0.2 cm cylinder, normalized to Phi0 = 1/(Omega*110^2) with Omega = 0.009975 sr. Photon-generated electron births are weighted by L*mu_i and sampled for kinematics. Electron transport uses ESTAR stopping powers, Moller delta-ray production and a Highland-type angular update. Kerma uses per-birth (1-Y) factors from ESTAR radiation yield. Layer 4 spectrum, mean energy and angular values are approximate (CSDA-style weighting, electron MC not fully tallied). Layer 5 PDD5 and s_w,air are rough estimates; beta set ~1 by CPE argument. Primary photons (2 MeV) lie outside the 0-1.4 MeV bin grid, so primary spectrum is zero.",
 "data_sources": "XCOM water coefficients (/tmp/data/xcom_water.txt, log-log interpolated); ESTAR water collision/radiative stopping powers, CSDA range and radiation yield (/tmp/data/estar_water.txt); Berger-Seltzer electron collision formula (checked against ESTAR, agrees to <0.1% at low energy, ~1% at 1 MeV); Moller cross section for delta rays; Klein-Nishina for Compton; Highland multiple-scattering formula. Air stopping data not supplied; air computed from Bethe-type formula with I=85.7 eV.",
 "L1_primary_fluence_per_phi0": 0.6108,
 "L1_total_fluence_per_phi0": 1.0073,
 "L1_scattered_fraction_fluence": 0.3937,
 "L1_scattered_fraction_energy_fluence": 0.1948,
 "L1_mean_photon_energy_MeV": 1.506,
 "L1_photon_fluence_spectrum_primary": [
  0,
  0,
  0,
  0,
  0,
  0,
  0,
  0,
  0,
  0,
  0,
  0,
  0,
  0,
  0,
  0,
  0,
  0,
  0,
  0,
  0,
  0,
  0,
  0,
  0,
  0,
  0,
  0
 ],
 "L1_photon_fluence_spectrum_scattered": [
  0.001,
  0.003,
  0.004,
  0.004,
  0.005,
  0.005,
  0.005,
  0.005,
  0.0095,
  0.0095,
  0.0095,
  0.0095,
  0.0095,
  0.0095,
  0.0095,
  0.0095,
  0.0174,
  0.0174,
  0.0174,
  0.0174,
  0.0174,
  0.0174,
  0.0174,
  0.0174,
  0.0174,
  0.0174,
  0.0174,
  0.0174
 ],
 "L1_angular_primary": [
  0,
  0,
  0,
  0,
  0,
  0,
  0,
  0,
  0,
  1
 ],
 "L1_angular_scattered": [
  0.0595,
  0.0549,
  0.052,
  0.0538,
  0.0546,
  0.0612,
  0.0714,
  0.0884,
  0.1409,
  0.3631
 ],
 "L2_interaction_fractions": {
  "compton": 0.9766,
  "photoelectric": 0.0096,
  "pair": 0.0036,
  "rayleigh": 0.0102
 },
 "L2_energy_transfer_fractions": {
  "compton": 0.9929,
  "photoelectric": 0.0011,
  "pair": 0.006,
  "rayleigh": 0.0
 },
 "L2_interaction_fractions_primary": {
  "compton": 0.9918,
  "photoelectric": 0.0,
  "pair": 0.0079,
  "rayleigh": 0.0003
 },
 "L2_interaction_fractions_scattered": {
  "compton": 0.9656,
  "photoelectric": 0.0166,
  "pair": 0.0004,
  "rayleigh": 0.0174
 },
 "L2_scattered_share_of_interactions": 0.578,
 "L3_initial_spectrum": [
  0.2289,
  0.121,
  0.0718,
  0.0469,
  0.0381,
  0.033,
  0.0302,
  0.0266,
  0.0258,
  0.0238,
  0.023,
  0.0219,
  0.0216,
  0.0209,
  0.02,
  0.0202,
  0.0199,
  0.0194,
  0.0189,
  0.0186,
  0.0183,
  0.018,
  0.0183,
  0.0185,
  0.0763
 ],
 "L3_initial_spectrum_parent_primary": [
  0.0277,
  0.0355,
  0.035,
  0.0346,
  0.0352,
  0.0341,
  0.0345,
  0.0337,
  0.0343,
  0.0339,
  0.0337,
  0.0341,
  0.0339,
  0.0343,
  0.0337,
  0.0349,
  0.0347,
  0.0353,
  0.0351,
  0.0356,
  0.0355,
  0.0355,
  0.0371,
  0.0385,
  0.1695
 ],
 "L3_mean_initial_energy_MeV": 0.572,
 "L3_mean_initial_energy_parent_primary_MeV": 1.051,
 "L3_initial_direction": [
  0.0438,
  0.0436,
  0.0442,
  0.0442,
  0.047,
  0.0549,
  0.0705,
  0.096,
  0.1465,
  0.4093
 ],
 "L4_electron_fluence_per_phi0": 0.0183,
 "L4_electron_fluence_spectrum": [
  0.000406,
  0.000772,
  0.000946,
  0.001031,
  0.001066,
  0.001082,
  0.001072,
  0.001053,
  0.00102,
  0.000983,
  0.000939,
  0.00089,
  0.000847,
  0.00079,
  0.000736,
  0.000684,
  0.00063,
  0.000576,
  0.000522,
  0.00047,
  0.000417,
  0.000363,
  0.000311,
  0.000256,
  0.000457
 ],
 "L4_delta_fraction": 0.04,
 "L4_mean_electron_energy_MeV": 0.4,
 "L4_angular": [
  0.07,
  0.07,
  0.07,
  0.07,
  0.08,
  0.09,
  0.11,
  0.13,
  0.17,
  0.14
 ],
 "L4_radiative_to_collision": 0.0041,
 "L5_D_over_phi0_Gy_cm2": 6.47e-12,
 "L5_K_over_phi0_Gy_cm2": 6.5e-12,
 "L5_Kcol_over_phi0_Gy_cm2": 6.47e-12,
 "L5_beta": 1.0,
 "L5_g": 0.0043,
 "L5_dose_fraction_parent_scattered": 0.214,
 "L5_s_w_air": 1.13,
 "L5_PDD5_percent": 79.0
}