{
 "method": "Estimated values based on photon and electron interaction cross-sections and energy transfer properties in water, using data from NIST PSTAR/ASTAR. Primary photon attenuation was calculated. Scattered photon fluence and spectra were approximated. Electron spectra and angular distributions were derived from the dominant interaction processes (Compton, Photoelectric, Pair Production). Energy deposition and kerma were calculated using standard definitions and estimated charged particle energy loss. Stopping powers were taken from NIST databases. Spectral and angular distributions are approximations.",
 "data_sources": "NIST PSTAR and ASTAR databases for photon cross-sections, electron/positron stopping powers, and ranges in water. Approximated Compton energy transfer efficiencies and angular distributions.",
 "L1_primary_fluence_per_phi0": 0.7007,
 "L1_total_fluence_per_phi0": 1.001,
 "L1_scattered_fraction_fluence": 0.3003,
 "L1_scattered_fraction_energy_fluence": 0.18,
 "L1_mean_photon_energy_MeV": 0.997,
 "L1_photon_fluence_spectrum_primary": [
  0.0,
  0.0,
  0.0,
  0.0,
  0.0,
  0.0,
  0.0,
  0.0,
  0.0,
  0.0,
  0.0,
  0.0,
  0.0,
  0.0,
  0.0,
  0.0,
  0.0,
  0.0,
  0.0,
  0.0,
  0.0,
  0.0,
  0.0,
  0.35035,
  0.0,
  0.0,
  0.35035,
  0.0
 ],
 "L1_photon_fluence_spectrum_scattered": [
  0.03003,
  0.04505,
  0.04505,
  0.03604,
  0.03003,
  0.02402,
  0.02102,
  0.01802,
  0.01502,
  0.01201,
  0.00901,
  0.00901,
  0.00601,
  0.00601,
  0.0045,
  0.0045,
  0.003,
  0.003,
  0.0015,
  0.0015,
  0.0006,
  0.0006,
  0.0003,
  0.0,
  0.0,
  0.0,
  0.0,
  0.0
 ],
 "L1_angular_primary": [
  0.0,
  0.0,
  0.0,
  0.0,
  0.0,
  0.0,
  0.0,
  0.0,
  0.0,
  1.0
 ],
 "L1_angular_scattered": [
  0.01,
  0.01,
  0.05,
  0.1,
  0.15,
  0.2,
  0.25,
  0.15,
  0.07,
  0.02
 ],
 "L2_interaction_fractions": {
  "compton": 0.8441,
  "photoelectric": 0.001,
  "pair": 0.1525,
  "rayleigh": 0.003
 },
 "L2_energy_transfer_fractions": {
  "compton": 0.7,
  "photoelectric": 0.01,
  "pair": 0.29,
  "rayleigh": 0.0
 },
 "L2_interaction_fractions_primary": {
  "compton": 0.8441,
  "photoelectric": 0.001,
  "pair": 0.1525,
  "rayleigh": 0.003
 },
 "L2_interaction_fractions_scattered": {
  "compton": 0.657,
  "photoelectric": 0.286,
  "pair": 0.0,
  "rayleigh": 0.057
 },
 "L2_scattered_share_of_interactions": 0.416,
 "L3_initial_spectrum": [
  0.01,
  0.03,
  0.05,
  0.07,
  0.08,
  0.09,
  0.09,
  0.08,
  0.07,
  0.06,
  0.05,
  0.04,
  0.04,
  0.03,
  0.03,
  0.02,
  0.02,
  0.01,
  0.01,
  0.005,
  0.005,
  0.005,
  0.005,
  0.005,
  0.005
 ],
 "L3_initial_spectrum_parent_primary": [
  0.0,
  0.0,
  0.0,
  0.0,
  0.0,
  0.0,
  0.0,
  0.0,
  0.0,
  0.0,
  0.01,
  0.02,
  0.03,
  0.04,
  0.05,
  0.06,
  0.07,
  0.08,
  0.09,
  0.1,
  0.1,
  0.1,
  0.1,
  0.05,
  0.05
 ],
 "L3_mean_initial_energy_MeV": 0.35,
 "L3_mean_initial_energy_parent_primary_MeV": 0.75,
 "L3_initial_direction": [
  0.01,
  0.02,
  0.05,
  0.1,
  0.15,
  0.25,
  0.25,
  0.1,
  0.06,
  0.01
 ],
 "L4_electron_fluence_per_phi0": 0.0012,
 "L4_electron_fluence_spectrum": [
  0.05,
  0.1,
  0.12,
  0.11,
  0.1,
  0.09,
  0.08,
  0.07,
  0.06,
  0.05,
  0.04,
  0.03,
  0.03,
  0.02,
  0.02,
  0.01,
  0.01,
  0.005,
  0.005,
  0.005,
  0.005,
  0.005,
  0.005,
  0.005,
  0.005
 ],
 "L4_delta_fraction": 0.25,
 "L4_mean_electron_energy_MeV": 0.22,
 "L4_angular": [
  0.01,
  0.02,
  0.05,
  0.1,
  0.15,
  0.25,
  0.25,
  0.1,
  0.06,
  0.01
 ],
 "L4_radiative_to_collision": 0.005,
 "L5_D_over_phi0_Gy_cm2": 8.5e-05,
 "L5_K_over_phi0_Gy_cm2": 9.5e-05,
 "L5_Kcol_over_phi0_Gy_cm2": 8.8e-05,
 "L5_beta": 0.966,
 "L5_g": 0.005,
 "L5_dose_fraction_parent_scattered": 0.45,
 "L5_s_w_air": 1.15,
 "L5_PDD5_percent": 55.0
}